trade,social_studies,1,14,,MC,5,A. The country's ____ in manufactured goods has expanded in the last ten years. B. 70 percent of the country's ____ is with Europe.,snail,*trade,solid,mixture
colony,social_studies,1,13,,MC,5,A. In 59 B.C. a ____ was established here by Caesar. B. The ____ of ants were very efficient when they all worked together.,pole,*colony,principal,dissolve
freedom,social_studies,1,13,,MC,5,"A. Children are allowed much more ____ these days. B. In college, you have the ____ to do what you want.",invention,strategy,*freedom,cattle
market,social_studies,1,13,,MC,5,A. Are you sure there's a ____ for the product? B. We estimate the potential ____ for the new phones to be around one million people in this country alone.,*market,environment,beetle,mixture
custom,social_studies,1,12,,MC,5,"A. In my country, it's the ____ (for women) to get married in white. B. Most of our ____ comes from tourists nowadays.",fossil,*custom,plain,property
independence,social_studies,1,12,,MC,5,A. Mexico gained its ____ from Spain in 1821. B. The country gained its ____ in 1991.,*independence,constitution,thermometer,subtract
party,social_studies,1,11,,MC,5,A. The ____ have just elected a new leader. B. He was elected as ____ leader in 2011.,party,*party,invention,unit
pilgrim,social_studies,1,11,,MC,5,"A. ""Lord Jesus Christ!"" exclaimed the ____ woman, crossing herself. B. High, representing the ____ Faith.",complete,*pilgrim,statue,independence
plain,social_studies,1,11,,MC,5,A. She wore a ____ black dress. B. We've chosen a ____ carpet  and patterned curtains.,journal,*plain,grow,pattern
celebration,social_studies,1,10,,MC,5,A. Let's buy some champagne in ____ of her safe arrival. B. They planned a special ____ for her homecoming.,*celebration,each,addition,narrator
citizenship,social_studies,1,10,,MC,5,A. He holds joint ____ in Sweden and Peru. B. He was granted Canadian ____ last year.,*citizenship,mathematical,diagram,atlas
factory,social_studies,1,10,,MC,5,A. She worked in a ____ that produced air conditioners. B. The textile ____ used to be the biggest employer in town.,natural,vapor,predict,*factory
crop,social_studies,1,9,,MC,5,A. The judges will select the best from this year's ____ of first novels. B. Apple growers celebrated their biggest ____ ever last year.,*crop,beetle,history,solve
volunteer,social_studies,1,9,,MC,5,"A. It's a ____ army with no paid professionals. B. If I were you, I wouldn't ____ any details of what happened.",*volunteer,atlas,grace,ocean
constitution,social_studies,1,8,,MC,5,"A. Mexico's ____ guarantees the right of free travel to its citizens. B. Following these changes, it was proposed that the company's ____ be amended.",inquiry,*constitution,continent,nation
folktale,social_studies,1,8,,MC,5,A. The story of the Boy Who Cried Wolf is an example of a ____. B. I looked like one of those peasant girls in the old ____s.,mammal,*folktale,geography,below
governor,social_studies,1,8,,MC,5,A. His latest role was as ____ of the Open Market Committee. B. The ____ will sign the finance bill into law tomorrow.,*governor,natural,insect,reuse
mayor,social_studies,1,8,,MC,5,"A. The ____ announced a reorganization of the police department. B. The prime minister met many civic leaders, including the ____ and the leaders of the immigrant communities.",astronaut,*mayor,pulley,pole
museum,social_studies,1,8,,MC,5,A. The ____ is full of rare and precious treasures. B. Make sure you visit the maritime ____ if you're interested in anything to do with ships or seafaring.,pulley,immigrant,estimate,*museum
nation,social_studies,1,8,,MC,5,A. Practically the whole ____ watched the ceremony on television. B. Throughout the ____ today people will go to the polls to elect a new government.,*nation,resource,motion,museum
pledge,social_studies,1,8,,MC,5,A. I give you this ring as a ____ of my everlasting love for you. B. We are asking people to ____ their support for our campaign.,survive,symbol,tadpole,*pledge
invention,social_studies,1,7,,MC,5,A. The world changed rapidly after the ____ of the phone. B. Be careful what you believe - her powers of ____ are well known.,nation,*invention,mixture,principal
language,social_studies,1,7,,MC,5,A. Her ____ skills are excellent. B. It's easier to learn a ____ when you're younger.,discover,subtract,*language,fossil
route,social_studies,1,7,,MC,5,A. The ____ we had planned took us right across Greece. B. I live on a bus ____ so I can easily get to work.,shape,immigrant,*route,graph
capital,social_studies,1,6,,MC,5,A. Australia's ____ city is Canberra. B. London used to be the financial ____ of the world.,*capital,capitol,snail,celebration
statue,social_studies,1,6,,MC,5,A. They planned to put up a ____ of the president. B. A ____ has been built to commemorate the 100th anniversary of the poet's birthday.,chart,liquid,rocket,*statue
grace,social_studies,1,5,,MC,5,A. Joanna has natural ____ and elegance. B. Betty believed that it was through divine ____ that her husband had recovered from his illness.,natural,suburb,*grace,reflect
immigrant,social_studies,1,5,,MC,5,A. There is a large Indian ____ population. B. Boston is the second ____ port of the country.,model,mammal,*immigrant,engineer
war,social_studies,1,5,,MC,5,A. If this country goes to ____ many people will die. B. Britain and France declared ____ on Germany in 1939 as a result of the invasion of Poland.,border,plastic,symbol,*war
atlas,social_studies,1,4,,MC,5,"A. For those of you who don't have an ____ to hand, Newcastle is a city in the northeaeast of England. B. Are you through with that ____?",cube,envision,*atlas,engineer
capitol,social_studies,1,4,,MC,5,"A. The new state ____ was finished in 1903. The most prominent building is the ____, about 400 ft.",pattern,*capitol,nation,chart
discover,social_studies,1,4,,MC,5,A. We reviewed enrollment figures to ____ exactly when and why the student population declined. B. Researchers hope to ____ new treatments that may help people suffering from migraine headaches.,*discover,topic,envision,estimate
geography,social_studies,1,4,,MC,5,A. It's impossible to figure out the ____ of this hospital. B. Japan is ____-ally close to North Korea.,model,ant,*geography,snail
border,social_studies,1,3,,MC,5,A. The train crosses the ____ between France and Spain. B. The two countries have had frequent ____ disputes.,journal,*border,pilgrim,snail
cattle,social_studies,1,3,,MC,5,A. These ____ are being fattened up for slaughter. B. The farmer grazes ____ on this land in the summer months.,*cattle,snail,lever,capital
dam,social_studies,1,3,,MC,5,"A. The rest was blocked, as if a ____ was placed there. B. The ____ differs in shape according to the nature of particular localities.",liquid,*dam,resource,plain
landmark,social_studies,1,3,,MC,5,A. The invention of the silicon chip was a ____ in the history of the computer. B. Ward Hill (742 ft.) is the sailors' ____ for Lerwick harbour.,liquid,journal,*landmark,math
literary,social_studies,1,3,,MC,5,A. She contributed poems to ____ magazines. B. She has been described as the creative colossus of the ____ world.,data,*literary,energy,reuse
narrator,social_studies,1,3,,MC,5,A. The ____ assumes that Adam and Eve had an innate faculty of speech. B. The name is taken by the ____ of Gen.,magnet,liquid,*narrator,pole
principal,social_studies,1,3,,MC,5,A. Iraq's ____ export is oil. B. He was ____ dancer at the Dance Theatre of Harlem.,hive,reptile,*principal,culture
suburb,social_studies,1,3,,MC,5,A. Box Hill is a ____ of Melbourne. B. She opened a new location in the Dallas ____ of Richardson.,pilgrim,*suburb,museum,math
wheat,social_studies,1,3,,MC,5,A. Many ____ farmers have begun to diversify into other forms of agriculture. B. If he eats anything with ____ in it he's very sick.,data,solve,*wheat,magnet
